Document,Data
D1,"Space exploration has captivated humanity for decades, driving us to push the boundaries of what's possible. From the first manned moon landing to the exploration of Mars and beyond, scientists and engineers continue to innovate and explore the cosmos, seeking answers to some of the universe's most profound questions."
D2,"The vastness of space beckons us to explore its mysteries. With advancements in technology, we've sent probes to distant planets, discovered exoplanets orbiting other stars, and peered into the depths of black holes. Each discovery brings us closer to understanding our place in the universe and the potential for life beyond Earth."
D3,"The future of space exploration holds promise and excitement. From plans to establish human colonies on other planets to the dream of interstellar travel, the possibilities are endless. As we continue to venture further into space, we're driven by curiosity, wonder, and the desire to unlock the secrets of the cosmos."
D4,"The search for extraterrestrial life is a driving force behind space exploration. Scientists study extremophiles on Earth to understand the potential for life in extreme environments, while telescopes scan distant planets for signs of habitability. Discovering life beyond Earth would be a profound moment for humanity."
D5,"Space agencies around the world collaborate on ambitious missions to explore our solar system and beyond. From the Voyager probes venturing into interstellar space to the James Webb Space Telescope peering into the early universe, these missions expand our understanding of the cosmos."
D6,"The challenges of space exploration are vast, from the harsh conditions of space to the complexities of interplanetary travel. Engineers and scientists work tirelessly to develop spacecraft, propulsion systems, and life support technologies to overcome these challenges and enable human exploration of the cosmos."
D7,"Exploring the moons of our solar system offers insights into the potential for life beyond Earth. Europa, with its subsurface ocean, and Enceladus, with its geysers of water vapor, are among the most intriguing targets for future exploration. These icy worlds may harbor the ingredients for life."
D8,"Space telescopes revolutionize our understanding of the universe by observing distant galaxies, black holes, and the cosmic microwave background. From the Hubble Space Telescope to the upcoming Nancy Grace Roman Space Telescope, these observatories provide a window into the cosmos."
D9,"Space tourism is on the horizon, offering civilians the opportunity to experience the wonders of space firsthand. Companies like SpaceX and Blue Origin are developing spacecraft capable of carrying tourists to the edge of space, opening up a new era of commercial spaceflight."
D10,"The exploration of Mars is a key focus of space agencies worldwide. Rovers like Curiosity and Perseverance study the Martian surface, searching for signs of past life and preparing for future human missions. Mars holds the potential to become a second home for humanity."
D11,"The International Space Station (ISS) serves as a platform for scientific research and international collaboration in space. Astronauts conduct experiments in biology, physics, and materials science, paving the way for future long-duration space missions and exploration beyond Earth orbit."
D12,"Space debris poses a growing threat to space exploration and satellite operations. With thousands of defunct satellites and debris fragments orbiting Earth, there is a pressing need for international cooperation to mitigate the risks and ensure the sustainability of space activities."
D13,"Lunar exploration offers valuable resources and scientific insights for future space missions. Plans to return humans to the Moon, establish lunar bases, and mine lunar resources are driving renewed interest in our nearest celestial neighbor as a stepping stone for further exploration of the solar system."
D14,"The study of exoplanets expands our understanding of planetary systems beyond our own. Astronomers use telescopes like Kepler and TESS to discover thousands of exoplanets orbiting distant stars, revealing a diverse array of worlds and raising questions about the prevalence of life in the universe."
D15,"Space-based technologies, such as GPS satellites and Earth observation satellites, have revolutionized industries on Earth. From navigation and communication to weather forecasting and disaster management, these technologies have become integral to our daily lives."
D16,"Astrophysics explores the fundamental properties of the universe, from the nature of dark matter and dark energy to the origins of cosmic structures. Observatories like the Atacama Large Millimeter Array (ALMA) and the Chandra X-ray Observatory probe the cosmos at different wavelengths, providing insights into its mysteries."
D17,"The privatization of space exploration has led to a new era of innovation and competition. Companies like SpaceX, Blue Origin, and Virgin Galactic are driving down the cost of access to space and accelerating the development of new technologies for space travel and exploration."
D18,"Colonizing other planets offers a potential solution to challenges such as overpopulation and resource depletion on Earth. Mars, with its similarities to our own planet, is a prime candidate for human settlement, sparking discussions about the ethical, social, and environmental implications of space colonization."
D19,"The study of asteroids and comets provides insights into the formation and evolution of the solar system. Missions like OSIRIS-REx and Rosetta study these celestial bodies up close, shedding light on their composition, structure, and potential threats to Earth."
D20,"Interstellar travel remains a distant but tantalizing possibility for humanity. Concepts like warp drives and solar sails offer theoretical avenues for traveling to other star systems, sparking the imagination and pushing the boundaries of our understanding of physics and engineering."
D21,"Space law and policy govern the rights and responsibilities of nations and organizations in space. With the increasing commercialization of space activities, there is a need for clear regulations to ensure safety, security, and sustainability in the exploration and use of outer space."
D22,"The study of black holes challenges our understanding of gravity and the nature of spacetime. Observations from telescopes like the Event Horizon Telescope provide evidence for the existence of black holes and offer insights into their formation, behavior, and effects on the surrounding universe."
D23,"The concept of a space elevator offers a novel approach to space transportation. By using a tether anchored to the Earth's surface and extending into space, a space elevator could provide a cost-effective and efficient means of transporting payloads and people to orbit and beyond."
D24,"Astrobiology explores the potential for life elsewhere in the universe. Scientists study extreme environments on Earth and the possibility of habitable zones on other planets and moons, searching for signs of life beyond our own planet and contemplating the implications for humanity."
D25,"Space agencies collaborate on international missions to explore the outer reaches of the solar system. From joint missions to Jupiter and Saturn to cooperative efforts to study the sun and its effects on space weather, these partnerships advance our understanding of the solar system and beyond."